Topic,Topic prob,diff,Document,Tweet
7,0.6144937515436852,0.3289981597979311,1795,ventilator assist control comes much lower cost within rs vs standard rs l thinking making health inclusive right portable device definitely make treatments much accessible everyone
7,0.41999219606983823,1.4532674703526816e-05,1796,watching little turtles like thing beauty joy forever let nature restore beauty thank sharing
3,0.44069480894766483,0.17876628248939835,1797,indian announced train tickets booked till special operated cancelled passengers get refund ticket amount
1,0.21879037996021816,0.016637877670862694,1798,added covid last weeks majority migrant better planned cud hv saved state efforts n resources suffering migrants
6,0.6999444331669258,0.6665914954570191,1799,harder work something greater feel achieve
0,0.8874842333383849,0.8749806181159443,1800,gentle reminder respected ji hoping help support end possible please look matter urgent basis provide immediate solution difficult time
1,0.58569987964941,0.33141278453907363,1801,good morning begin day collaborating yourquote baba read thoughts
7,0.6999706446033579,0.6666201048512354,1802,indian boxer air force man kavinder bisht story
3,0.6602478043633958,0.4538465675639938,1803,breaking date time positive case till date cured death new case death hours recovery rate
3,0.6999799742028316,0.6666282316222377,1804,dua whole last days kareem
1,0.8199931986385468,0.7999889648369704,1805,good energy contageous hope everyone staying safe
1,0.6307746085248402,0.3615552955924981,1806,maharashtra big problem please guys safe n stay home nothing important thn life
6,0.40195987576930436,0.18894374086900526,1807,mera bharat mahan dharm jagriti yuva mandal via love work milap john tried something similar dedicated corona patients
4,0.39608745400172707,0.05885623451325678,1808,small sculpture garden representative sample rich artistic heritage brings stone life day
8,0.3099044701262043,0.04825888577801857,1809,feel come nearer suspected patient take thorough bath next months follow precautions
9,0.39434861898651413,0.08869789678427614,1810,prefer vegetarian food increase carefull avoid unnecessary meetings always keep mind dont wear belt rings wrist watch go
1,0.5499903332072934,0.4999847919767519,1811,sun moon bird big winged one elements present lt
2,0.5249964779175781,0.2499966572345897,1812,ahluwalia mp bardhaman durgapur ls raising pertinent points need augment awareness govt wb callous downright inhuman appalling response covid
3,0.6833279534406911,0.4999954660731727,1813,open system able sustain open vent allows rigid escape abstain open introspection life meaning utility open rejection hypocrisy futility contd
0,0.5499907314404292,0.49998425739123403,1814,defined class students divided basis different status thats racist define class blueprints unified attributes methods bro offense
0,0.4083172096349072,0.08330648431618703,1815,delighted invited judge final round judging happened remotely due saw teams st xaviers etc
4,0.5499893394849662,0.4999847569780508,1816,itsokaynotbeokay shailja link via
3,0.3684703762574723,0.1506553096332648,1817,ok precaution stopped ordering swiggy protect health risk another unsealed container better train staff refuse open containers
8,0.8499672935850415,0.8332810192289963,1818,things need reopen conservation took virus realise still healed human wants vid via stevecutts
3,0.8199866810254125,0.7999781130044334,1819,india crossed china total cases india ranked china slipped
8,0.6999776733599683,0.6666319169419866,1820,hit world record support fav
6,0.32560971528263066,0.027191080027838377,1821,world crumbling today labourers poors road others locked many lost loved ones crisis humans swdharma join hands serve one step giant leap come everbody
2,0.5249994819866229,0.2500031240513192,1822,consider fact negligence taken granted behaviour person involved otherwise dilute purpose testing stop spread
1,0.34999701301720176,0.04120155966928951,1823,migrant workers found walking roads taken nearby shelters provided food water mha states
4,0.6999935149314268,0.6666538480164472,1824,night days days night embrace changes hang tight
8,0.8199765331435027,0.7999690079722102,1825,watches chakde millionth time cries much like first
6,0.3590817864788211,0.0329637723674267,1826,concern every indian today till strict measures taken see migrants conditions painful
4,0.8499905992539696,0.8333198768059551,1827,update india crosses recoveries days days days days
3,0.5847469335984709,0.3028289575372181,1828,update india crosses china total number reported covid cases stands position list
5,0.69994367636116,0.6665860551775817,1829,say also track
9,0.7403486321374261,0.5695982564451701,1830,travel absolutely essential let us follow precautionary measures stay safe
3,0.49019524440551915,0.24679325727642457,1831,paid bill today resume airtel services least days pay balance within days please humble strong request trouble time thanks karan nagar
4,0.39529726935014636,0.05726719195707852,1832,n shailja diys via
6,0.37531066399356683,0.11009680548480272,1833,good news punjab total covid postive patients recovered got discharged hospital
1,0.37171532921000744,0.12852518139538963,1834,matter whar governments say measures migrant workers truth matter suffering day one lockdown government prepared journey back home govt states central failed
2,0.3946116185013582,0.14923360563700067,1835,change covid pandemic impact business certainly improve response give another try
1,0.7749944103271961,0.7499906180720395,1836,stay safe strong protein rich foods home curd milk buttermilk cheese pistachios grams soybean lentils
8,0.5249635701333517,0.24996697608572727,1837,give place yr old savir tell happy place savir rainfall colorful birds stop flying sun shines smiles
9,0.6887935004226113,0.5109285858018371,1838,exercise consumption healthy diets lockdown must follow guidelines given
1,0.49221848818347846,0.21139207912316405,1839,saint dr singh ji insan says exercise daily good physical health promotes good mental health tips helpful tips beat corona
9,0.6619347718191855,0.4572225157433554,1840,know time kill follow given meditation breathing exercises eat healthy vitamin c rich food strong immune system wash hands frequently soap
9,0.7403396202840666,0.5807009395708091,1841,advised follow guidelines given government also given useful suggestions beat corona
7,0.27959011060280625,0.004589847021907012,1842,suggested saint singh ji insan following predictions save coronavirus
1,0.24752960771193996,0.0009736614210376915,1843,consume vitamin c like oranges lemon amla also take pistachios grams soybeans boost immunity fight corona virus
2,0.3679655747576155,0.039149571746481815,1844,learned contributors spreading rumours stats case covid patient increasing per day number tests also increasing proportional manner
3,0.5499931137608024,0.49998784074849073,1845,samosa story new sound effects animation
6,0.7021627374068766,0.5043354935492299,1846,maharashtra government take lesson two uttar pradesh management wuhan virus clarity purpose deal pandemic objectively without partisan behaviour professional firm action needed deal present situation
6,0.5499977202107467,0.4999954406682359,1847,option c join
0,0.5712906239804132,0.25689252956860387,1848,sir support statement use gold stored indian temples recover economic crisis situation idiots society deny fact please consider temples
6,0.5249835491733595,0.24998392111244339,1849,increased tests would definitly help control pandemic beside cluster containment early screening symptom detection self regulation
4,0.5649333326823226,0.40826144832849776,1850,strange true st said good break chain days days days days days guess much insane lockdowns break open please
4,0.6999862246665509,0.6666449204258891,1851,day red vented bulbul
4,0.5828185586214081,0.27994081716408714,1852,nation wide lockdown prevent contagion novel corona virus crosses days online food delivery platform zomato announced retrenchment manpower severely affected business
0,0.5499907314404292,0.49998425739123403,1853,thmay wndrfl wid different eminent personalities dr educationist gaurav bhatara mp br kamrah
9,0.3231057859982862,0.06814593190348672,1854,time asked team members things going lockdown ends listen say advise maintain social distancing dark days soon till
3,0.39363544750695334,0.10275591950763852,1855,kerala reports new covid cases today including travelled tamil nadu mumbai foreign countries personnel treated various part state
8,0.5499860574729076,0.4999777971052286,1856,fun meter excitement always high learning instruction writing cooking activity floral toast parulmehrotra
2,0.54997600838637,0.49996560959101954,1857,india crossed china
6,0.5499977202107467,0.4999954406682359,1858,following everywhere join
1,0.5093801689691565,0.21877218810324228,1859,mere aur mere parivaar ki traf se police nagar nigam ke workers doctors nurses ngos volunteers government officials vendors building ke guards ko
8,0.84997608760054,0.8332977689105248,1860,privileged enough daily wage hard hit pandemic come forward help need
1,0.5199458194328594,0.23991862049369694,1861,start day flavourful mango smoothie made fresh mangoes chia seeds organic honey greek yogurt order
5,0.5499834490295648,0.49997252359539823,1862,honda wheelers retails serviced lac units may
1,0.7749944103271961,0.7499906180720395,1863,stay safe home
4,0.36666553618501124,3.5511639313590138e-06,1864,new relationship lockdown isolationship ap batao apke kya haal hain
8,0.5499905305700455,0.4999840378505535,1865,live moments put words quarantined
0,0.5499876304250033,0.4999828440804269,1866,facts due unplanned
5,0.5233393195664165,0.24669511423351853,1867,amazing mock day work session trainees today interactive fun session register office assistant training program link bio
3,0.35696508062882226,0.07119675957880489,1868,good news punjab covid patients recovered got discharged hospital today amritsar moga ferozepur bathinda gurdaspur hoshiarpur total
3,0.35667539080310623,0.018724707702682086,1869,get tired learning new things lockdown lockdown day new delhi
8,0.7337664927460689,0.5675576282378489,1870,till distributed ration kits needy families due many labour families facing hunger still packing distributions keep supporting need blessings
0,0.5499908163854383,0.4999866897063691,1871,whole hey hear audible look distorted network
1,0.5499832196946848,0.499973838112573,1872,wide range laptops available ep stores shop directly comfort home order
5,0.4745161520583769,0.24904698774247588,1873,husband death became earning member family every source income came end blessed receive atleast month ration supply smile rush back hometown neena
8,0.5249714409333655,0.2499712592141921,1874,irony religious fair get rid f de violate norms contain panic x fight bst b sporty happy
4,0.47391322258890844,0.10786761385105659,1875,atmanirbhar swadeshi movement coronavirus pushing india towards economic crisis substitute daily essentials
1,0.543276055270737,0.3599448551308986,1876,work home new way companies operate transform office space challenges convenience meanwhile work desk
1,0.47407011922849246,0.21409228315395834,1877,understand allowed walk back home even days administration party man leader stop help shelter food transport looks like everyone wants bad story
2,0.4755860950170469,0.08451981204973713,1878,india handling pandemic patience discipline alertness last days districts reported covid case
4,0.4227470891871498,0.09581369100956777,1879,india taking several measures facilitate farmers farming activities field level lockdown functional agricultural markets almost doubled since beginning lockdown increasing supply fruits vegetables via namo
2,0.8499851530734195,0.8333094151419077,1880,collective power villages helping country move forward tough times gaj doori rural india mantra fight covid
1,0.3781251694093276,0.11996652708496175,1881,masks face covers become part lives people days ahead everyone aim must ensure rapid response current circumstances
7,0.9099657868471355,0.8999557215382457,1882,modi govt efforts yielded results country managed save thousands lives past one half months due lockdown
7,0.6708161390993694,0.4305353889293394,1883,indian air force stepped efforts meet emerging requirements combat contagion iaf continues airlift essential supplies medicine ration along medical personnel across country
2,0.8499873841911937,0.8333116452666742,1884,graded pre emptive pro active approach modi govt taking several steps prevention containment management covid
3,0.4108989178199646,0.13784703056659015,1885,india response covid spearheaded smart cities agra smart city created gis dashboard show various hotspots heat map positive cases recovered cases etc
0,0.5257456202462858,0.2514992161393999,1886,given hardships faced parents students due covid epidemic national testing agency nta revises dates submission online application forms various examinations
6,0.8499775545349414,0.833303112162879,1887,global pandemic created unprecedented situations leaving large number people vulnerable hunger indian railways distributes free hot cooked meals crossing three million mark
5,0.8999871656963239,0.8888695667368193,1888,several activities remain prohibited across india irrespective zone include travel air rail metro inter state movement road well running schools colleges educational training coaching centres
7,0.36315623095610006,0.033044532072263766,1889,supplementing massive efforts govt facing defeating covid india armed forces show solidarity frontline soldiers undertake several activities saluting corona warriors may rd
2,0.8199946886443532,0.799991858638824,1890,heroes airforce frontline india fight covid operating lifeline udan flights far operational flights delivered tons cargo
4,0.35195231511546865,0.056797462327166204,1891,jan aushadhi sugam moblie app india medical lifeline lockdown lakh people locate nearest jan aushadhi kendras avail generic medicines app
2,0.6307215018927802,0.32298614576539997,1892,modi govt ensuring safety health personnel fight covid lakh n masks distributed far across states
7,0.5249862206730873,0.25000081053322776,1893,loved making course eating thanks wonderful demo learn much watching bake
6,0.5499941755390448,0.4999911349012099,1894,winners indeed nice experience watching many wonderful
6,0.5499977202107467,0.4999954406682359,1895,andhadhun join
2,0.8499885975862669,0.8333168726144142,1896,meet increasing demands ppes modi govt giving major thrust indigenous production ppes march india producing lakh ppe may
2,0.8199999911716944,0.7999999870664622,1897,smart cities harnessing technology tackle covid nashik smart city taken initiatives mobile applications body sanitization machines strengthen city fight covid
2,0.6715312409285372,0.47639742216357117,1898,modi govt launched ayush sanjivani mobile app useful generate data usage ayush advocacies measures among population impact prevention covid
1,0.5405451600616636,0.15383006807730182,1899,strengthening public health preparedness govt asian infrastructure investment bank signed us million covid emergency response health systems preparedness project first ever health sector support bank
2,0.4691953205123635,0.18055387160035252,1900,india steadily moving recovery path covid pandemic districts green zones lakh tests conducted recovery rate patients stands
8,0.5499999998267844,0.4999999998007921,1901,contest selected candidate ujjwal mohan category dance want participate send message bimt whatsapp
5,0.4376110665179086,0.035240246545911846,1902,countries benefited aid medical supplies sent india fight hailed heads state contrast heading global backlash g
6,0.6511847826988314,0.4357287463848915,1903,day may continuing topic half mind embrace arm hair tougher eyebrows one still contemplating glad itchiness problem hair grows many women complain
8,0.4199999613789884,0.20000006484443772,1904,give art chance article pioneer vivacity today newspaper give art chance pls read feedback
7,0.6999994827484352,0.6666658863343432,1905,corona updates
7,0.6999994827484352,0.6666658863343432,1906,corona updates
7,0.6999994827484352,0.6666658863343432,1907,corona updates
1,0.5249879877542176,0.24998863541517152,1908,safe corona virus
6,0.3844683449421471,0.10599323401782107,1909,according covid pandemic last long atleast years one save us disaster save use hand sanitizer use gloves use hankerchif
8,0.7749733300321848,0.7499617639617242,1910,good time switching electric vehicle go electric
2,0.7983118449274863,0.6766352517177179,1911,today th meeting gom group minister held covid country progress car counter virus spread measures taken discussed meeting important ahead announcement
5,0.4122391273387507,0.22638547268232118,1912,thanks welcoming family leaving slow motion video made ganesha taking rain bath yesterday may remover obstacles remove
4,0.5203226681911489,0.24070384849670395,1913,corona virus earth quick hell strom garmi lockdown gas leakage exam kya chahte ho prabhu nipta kr manoge ab
3,0.5655461632007749,0.3322142263589877,1914,sir r opening delhi pls open planning kejriwal planning ye delhi walo ka naam lekar khud lockdown kholna chahta hai need open open ideas
9,0.42699132977363013,0.01399502590184265,1915,pil filed supreme court seeking closure liquor shops lockdown dismissed apex court costs lakh imposed petitioner
6,0.279307474798965,0.004314950834122255,1916,repeatedly revised rewrote times confusing adding burden frontline medical administrative staff states laboratories write
0,0.5499998402536362,0.4999996805980955,1917,great man incredible
5,0.5513190199287117,0.23600311683119535,1918,mother received work nodal officer hn exactly decade recall day till midnight working press briefing wish sars cov wave behaved like hn
2,0.4691953205123635,0.18055387160035252,1919,india steadily moving recovery path covid pandemic districts green zones lakh tests conducted recovery rate patients stands
6,0.3666778060723959,4.512069251666473e-05,1920,hope floats camps via
5,0.40217278754004965,0.07102708052671403,1921,money boost billion announced india pradhan mantri garib kalyan yojana wb focus urban poor provide tailor fit funding local needs state level funding adaptive static
1,0.5017168543012206,0.30344619489192887,1922,announced billion social sector funding deal unorganized workers migrant labour state governments money specific schemes overall system whch vulnerable citizens supported
1,0.4896139176613969,0.1792375535243767,1923,good morning frnds follow posts
9,0.5499999998900983,0.4999999998733907,1924,maintain physical distancing
7,0.6999839714465109,0.6666397563658184,1925,break country exposed broken healthcare infrastructure country
5,0.549983494003753,0.4999771826659347,1926,today items delivered whole amount charged creating type issue
4,0.6999976098789662,0.6666629732175327,1927,food grains noida sector
4,0.5060841986067688,0.17218447967772188,1928,providing food children labourers since th april help contribute contact
6,0.36599291801647005,0.054136044207928335,1929,hope finally make happen national urban rental housing policy stuck yrs put backburner elections would go well sections electorate
1,0.6999646591897558,0.6666122472736036,1930,bare feet grass early morning comfort spirit day
6,0.41999830864952464,0.19999856522690046,1931,lord feel every relationship mera shiva may shiva bless us read thoughts
7,0.3558325787522385,0.07765421156642377,1932,worldwide corona cases crossed lakhs deaths lakh speed going dow gained points lows sgx also recovered points lows today make break day fm announcements important let wait
5,0.6796074346449247,0.49255454629034967,1933,punjab chief minister amarinder singh announces lockdown state continue till st month though government lift curfew restrictions monday
8,0.5249665633907636,0.24996638842940538,1934,need wings fly bcas panic x fight bst b sporty happy
2,0.28102021133035904,0.09507145338852,1935,story vision collaboration purpose govt large private sector start ups academicians u name came together one cause
9,0.5500517279746641,0.21440908933615632,1936,know whenver thought waking early morning wake sleep instead pm corona affected global economy also effect sleep
0,0.27529775113733923,0.0002985016016228137,1937,year old complaining lost half property due covid lockdown replied mom pregnant
6,0.5559497113046804,0.3119095388820994,1938,opening face see real face top sure care careful take easy still homes opening lockdown real test every
9,0.6172616233100792,0.39453315862407334,1939,big big big video tomorrow morning channel please miss bole ek dum jhakaas love topic dream smartphone laptop
8,0.5499934894125097,0.4999899552973463,1940,transforming better version learning leaving everything past perform decisive actions act problems blatant tactfully
1,0.36665589514037744,4.54484850925807e-06,1941,former add sec home visited kitchen check packing distribution mechanism maintain hygiene feed india drive
9,0.4029258421847811,0.07252924757100127,1942,please take note
2,0.28058669393715696,0.025561522730638164,1943,need superhero save lifes maintain alway wear public place follow government guidelines
9,0.7749793952418625,0.7499648046432223,1944,mean people used watch site open road understand
8,0.42297045680196027,0.157269915458228,1945,tell one thing know covid give people expectations instagram atleast know nothing instagram still click
1,0.8199745476020661,0.7999562591800271,1946,tag friend make home like made
6,0.35934653364878427,0.06405704251476946,1947,heard keeping distance smelled face mask helping keep safe social distance also wear good quality mask take care
6,0.5166427540156562,0.16664345038518696,1948,people maintain distance one meter queue receive relief material food distributed new delhi
9,0.6518154409433743,0.4636378084919316,1949,lockdown workout must watch old video
3,0.5249816978045778,0.2499825188265431,1950,sending love delhi india
0,0.48225718171646137,0.16452606701031275,1951,great platform learn thank sir organizing wonderful session
7,0.524997137559963,0.2500106329558804,1952,yes free way otherwise restricted area lives human fear
6,0.5166596992491755,0.3333264118191873,1953,want stop broadband service however us option app ivr nit option connect customer care
7,0.3830893819663915,0.03284615576541289,1954,ios device operator self photo bill lockdown option app ios available
6,0.6199908360654451,0.39998813210777073,1955,amazed see people practicing religiously big thank thanks creating awareness
4,0.5499751979733873,0.499967754566145,1956,day local produce friendly neighborhood mango tree
6,0.6121297338547416,0.38427639669497005,1957,media playing role providing relevant important information people even difficult times appreciable dr shirish kashikar director nimcj ahmedabad sewa parmodharam organized isrn
1,0.5499771866495943,0.49996628201687643,1958,looking like gareeb gorgeous sorry effect aap khud hi dekh lo makeup ne hume chamka dia agar aap bhi aise chamakna chahte hai tutorial dhayan se dekhege products jo
7,0.5499976618817202,0.4999963808196456,1959,reason channel doston subscribe kijye channel ko thank
2,0.5499934279670329,0.4999893854774393,1960,sincere effort son convey hon ble pm message
0,0.3500003933791493,0.0038039110089863604,1961,thank ji ji playing key role putting endless efforts fight
6,0.5856867891476083,0.2856867949378541,1962,saying increase test test test tests done minuscule till time position tests demand must remain partial economic activity allowed adequate safeguards otherwise bad times
2,0.27500020890454085,2.9241788616629627e-06,1963,humbled challenge facing many stepped share small contribution fight proud colleagues
4,0.5594451344365307,0.2522365737806639,1964,distance two yards mantra protect loved ones share information help us help
3,0.7749791730565813,0.7499680285113025,1965,new information may offer insight honesty china coronavirus numbers
2,0.5217592241174955,0.14353201472631155,1966,vo across india even grassroot level working serve nation people difficult times shri santosh gupta sewa parmodharam organized isrn
8,0.5499867140423333,0.4999767460178058,1967,tere bina sir shootfromhome
4,0.36666578609355627,3.413291175091704e-06,1968,lockdown vich kabootran da swag entering house full confidence
3,0.36666671226306824,1.609743741032288e-05,1969,throwback good old diwali party scenes delhi
9,0.8199866353484034,0.7999801939160389,1970,know know even know fine md aasim
2,0.5499702241740289,0.49995786332754305,1971,realty image nothing working class lollipop middle class employees
3,0.2749982108341559,9.750273885889005e-06,1972,webinar e way bill conducted cgst gautam buddh nagar capacity building officers presentation given shri chitresh gupta fca active participation officers
5,0.41999720998040213,8.896110796463574e-06,1973,let gear till may many reliefs concessions told
6,0.6077207526432761,0.3043560073971305,1974,painful also amazed see person busy making videos rather helping kid taking advantage situation people trouble please help
3,0.26250051204733815,0.02914601283869095,1975,thank anubhuti khanna behalf delhi circle recognising us fight unique way art delhi circle requests customers service passion safety concern
9,0.8199689979677924,0.7999596920368971,1976,risk exploited ways also increase due people home nobody looking happening streets
9,0.6999983476899452,0.6666633621236571,1977,madam income nill literally edge shops malls maid paid near future businesses r going normal bcoz
0,0.5494525704878945,0.3661236672607661,1978,thoughts plz read share valuable views corona pandemic positive side akash gupta
9,0.6999983476899452,0.6666633621236571,1979,madam abt shops malls paid run boutique mall husband kids stuff shop near future businesses r going normal bcoz
