Topic,Topic prob,diff,Document,Tweet
6,0.3402529573357168,0.006937793441932516,0,wonder indians dying response western countries lackadaisical take example india two months ago
6,0.3402529573357168,0.006937793441932516,1,wonder indians dying response western countries lackadaisical take example india two months ago
1,0.25279711695592955,0.032797101411089435,2,may desirable stay long threat subside need develop required technological interventions organisational strategies make feasible productive
4,0.5499981853646341,0.4999971605299837,3,fashion clothing brands focus xl sizes cuz size everybody buying lockdown heads huge business
7,0.35001340248179375,2.7805933726421372e-05,4,corona updates would interesting see outcomes decisions next weeks show us works
8,0.5978274225397008,0.2683935522828362,5,good thought source food directly frm farmers eat live becuz get food frm farmers time help time get obsession tur rajma n nominate
3,0.622198254443195,0.37774276860223654,6,today organization nirvaan bharat today dry food laborers distributed poor laborers delhi new ashok nagar
8,0.6999449702965277,0.6665878762029442,7,get quite far democracy convince majority victims minority protect
5,0.2864864365206519,0.01148644802150417,8,people say nothing impossible nothing everyday
7,0.6060925820164363,0.4495921844724175,9,tweet confirms real congress entire country urge congress voter come see run country much hatred much jealousy
8,0.4199995423346624,1.5764986458499664e-06,10,seek new old things new ways find build things
8,0.5367865944797772,0.34568556950782914,11,time look reminded wanted wife love sweetheart happy anniversary sweetheart thank wife give two gift yuvraj jha sivans jha
9,0.3666666516996515,3.0693677925797136e-05,12,amazon prime movie review madha telugu complete bull shit watch indian lock
8,0.6199862488130373,0.3999889149119198,13,thanku new lessons life welcome shows must go
3,0.6999805442050077,0.6666363364846799,14,cooking really tedious task finally cooked first time
9,0.5156457246870036,0.32736805409729064,15,slowly becoming quick entire video edit thing wrapped minute long vlog edit hours personal achievement video live tomorrow morning
8,0.5499867140423333,0.4999767460178058,16,inspired sir attempt minor mistakes managed pull
5,0.5857139645799551,0.4034020461692981,17,railways running trains special trains requisitioned state govts passengers brought facilitated state govts travel one come station tickets sold station
3,0.4049734576699809,0.12785470642313246,18,average delhi cases per day day
1,0.37019315180708134,0.007091925573823099,19,question ages though bring feeling belonging even flash blues perfect time indulgence thx
1,0.72856322259575,0.5714209195670208,20,corona part home sweet home safety mean without home
7,0.3728854926800963,0.00555328400375299,21,try simple tips engage home keep spirits high lockdown corona updates
6,0.34367081175280806,0.04734410621116342,22,preventing spread enough us declare victory bring countrymen despair say defeated worst pandemic centuries
2,0.6199845156888568,0.3999878472972276,23,rd may pm india stop dreaming
5,0.29991654278195296,0.07082354306732655,24,got figured government plans keep extending lockdown till see himalayas mumbai
4,0.4685827134177235,0.25774088898564523,25,heed government directives situation become like watermelon open green zones become red zone
2,0.6254784717712568,0.3843139771080507,26,agriculture pharma media education etc working nobody derails india even v respect power virus cleaning environment v humbly put plus v happily live hinduism
6,0.549993822373915,0.4999890930543805,27,trust nobody people talkin tellin lies
0,0.60164141025745,0.29218369548184425,28,see new role coming days sir huge success wish see big screen got new offer sir
9,0.40445331319525385,0.13820803414860888,29,delhi circle serving customers protective kits branches inside vicinity medical colleges hospitals customer service duty safety staff well customers concern
0,0.5499907314404292,0.49998425739123403,30,weekend scene hrs different workouts cycling interval shoulder core strength
6,0.5499927954081624,0.4999855909488547,31,every minute angry lose sixty seconds happiness ralph waldo emerson
1,0.4896922637243786,0.17938586830270414,32,perfect morning flow keep quarantine blues away teaching session visit link learn master
6,0.7749657125722074,0.7499461729987675,33,one gurudwara auckland served food people amidst
8,0.38907003882721586,0.04481673344439924,34,variety better mamra premium quality afghan almonds kagzi jumbo gms via
5,0.549999999865847,0.4999999998455815,35,horror story misgovernance replaced communism corrupt system inefficient allocation resources state patronage inept leadership
4,0.6999933687633018,0.666658058752091,36,day visitor yellow footed green pigeon
1,0.5249969975724289,0.2499976306570712,37,agree said declared stopped maximum tests treatment lockdown solution stop solution stop
9,0.6833277195867792,0.500000918314056,38,article today rightly concluded must ease cure worse disease open avenues social distancing easy implement elementary dear watson use commonsense delay
5,0.6104464626100969,0.3809027041772335,39,sanitization work malviya nagar thank special thanks
0,0.38182739537045873,0.03032212732457018,40,read letter corona
5,0.5499999997766832,0.4999999997429451,41,another saturday sporting planes
8,0.22238525411425294,0.002384984212112612,42,hello purchased refrigerator months ago delhi stopped cooling registered complaint technician saw product video call says problem compressor able come post lifting finding difficult
6,0.5166663366721125,0.3228379797571791,43,foodies within us wake us everyday try something delicious cnt order outside special reciepes tried
0,0.6256435047040096,0.411311895334446,44,planning study whether strain india undergone mutation spreading within country tha last months read
9,0.7617036299300739,0.6234122994839588,45,really sad know medical sample transportation open liquor shops get open third phase
8,0.43578682565796956,0.03158208811986257,46,male touch female female officer right touch male breach male rights female police also right touch male
9,0.549989803956462,0.4999824222630741,47,aloochap chatni mouth watering eat eat repeat follow
3,0.5499519161807457,0.4999298429115785,48,time ends either become completely insane mo
3,0.36666668080165465,3.911342781603988e-06,49,update feeding pampering total dogs cats started strays started trying cover many locations possible wish sponsor meal contribute ping
1,0.5095337781529499,0.2477811866307616,50,appreciate staying indoors real hero prevent virus one advice outside gonna help increase corona infected people plzz stay home
0,0.36666734023724773,1.1127836674007519e-05,51,continues provide meals doctors kitchen hospital closed dietician positive united sikhs immediately took sewa providing meals doctors medical staff
8,0.7749753460419477,0.7499628603871915,52,spicy fried potatoes dish never allow diet still love double tap like favourite dish guys comment
8,0.36666660496876397,1.1063541393963039e-05,53,jingle encouraging listeners leave home go remain season
9,0.8199700728591565,0.7999601796781397,54,matter priority people dying due lack medical facilities someone wants new palace ready
4,0.6999443440780043,0.6665786363888441,55,sathi india organization day date
4,0.3322643798648246,0.06634922844879315,56,everyday feeding would please share tag save help compassionate souls feed hungry souls
5,0.43419681027074686,0.06839980241324911,57,sanitation done mansa ram park near shiv mandir jj colony special thanks
4,0.49838860098651755,0.28346290651123396,58,india biggest day jump coronavirus cases count crosses read press release extension lockdown dt
2,0.5516853486243938,0.23672791619211925,59,day together together defeat family people counting
0,0.4502524367147028,0.13780977021445684,60,present face become important word face passing time stay home face mind please mention
2,0.4299473959912283,0.19031039638946828,61,kenya looks india lockdown explain people country india bn pple go partial curfew speaks india envoy kenya rahul chhabra much
0,0.6007671173298422,0.3615376931007343,62,look forward listen ms dixita mehta co founder zindagi foundation ceo psychologist head counsellor refresh restart lockdown given youth opportunity look within
2,0.4149463354221044,0.041286802517247145,63,food corporation india ensuring food every indian across nation lakh tonnes food grains transported various corners country via trains trucks ships
5,0.33996984795436785,0.015842469309666984,64,home studio watch today pm pm today
4,0.5499981853646341,0.4999971605299837,65,satisfied lockdown
6,0.8199828073904936,0.7999742767269555,66,keeping fit times essential good control type diabetes join fitness mins core session fitness forms
4,0.6999674581598193,0.6666220282757659,67,work progress outbreak food hunger campaign little seeds ngo
4,0.4428513347642715,0.14285176574208774,68,lockdown new delhi title post series photos taken lockdown
8,0.5499999998260837,0.49999999975929893,69,golden chance mass deaddiction ongoing world gutka lifetime opportunity
5,0.524964358322661,0.24996834865182804,70,burden sustaining sisters parents rented room became almost impossible dry ration distribution brought relief buying food supplies another month bother gurdeep
6,0.8199886855904122,0.7999809142813794,71,make make even us
0,0.6999975236021674,0.66666246408715,72,fascinating discussions capturing different subjects truly appreciative ji team
7,0.6999962879441395,0.6666607008948959,73,image speaks much louder words salute
6,0.33755906998571156,0.0414897462048443,74,untill develop vaccine covid live pandemic must make habit wearing mask washing hands frequently health workers deserves highest commendation let us appreciate corona warriors
5,0.549976082716998,0.49995966350411253,75,little girl looking pretty seen forever thanks
8,0.48357085929303306,0.1004871411504134,76,get share years looted treasure dynasty chamchagiri subsist approx month long much surprised time demand share
0,0.5022431601728939,0.20450373192114085,77,brutal crash click link see full video
0,0.705890609858082,0.5260842439153621,78,advice given passengers jaipur patna shramik special train trains r run movement labour migrant workers tourists stranded due
9,0.45665026209442255,0.08997108223487449,79,right open liquor shops due lockdown peoples engaged children family members drinking alcohol might create daunting situation
7,0.6999994827484352,0.6666658863343432,80,corona updates
7,0.6999994827484352,0.6666658863343432,81,corona updates
0,0.42000163429876974,0.1974727561110115,82,two great tastes taste great together maggie chai maggie forever
7,0.6999994827484352,0.6666658863343432,83,corona updates
2,0.472262865495354,0.2016893346619622,84,whole body workout along full entertainment right definition zenith dance workout catch us live facebook online sesssion today pm
7,0.5249799799310026,0.2499799728503317,85,change brand change shop visit website get groceries delivered straight door delhi ncr inquiry gt gt app
3,0.5249954187699187,0.24999577963825803,86,finished first thing would
6,0.8874739440576646,0.8749676473924178,87,appreciable work done government providing ration nation well done
9,0.324963511551832,0.0032282691366779526,88,changed many things life life outside meanwhile field works resumed haridwar taking care precautionary measures watch video know source youtube
2,0.5499999359764383,0.49999990380881953,89,nanomedicine covid
1,0.8199530221237965,0.7999318534177992,90,shgs make one crore masks
5,0.3713942021871309,0.00946690597873956,91,get summer ready latest air conditioners available nearest ep store enquire
8,0.4755263244808988,0.15107907849394275,92,let relaxation zone forgo still possible
6,0.6999966636754915,0.6666607720286168,93,dogmatic people call remember lovely educated people call
5,0.7749607812109602,0.7499480492347033,94,main purpose rigorously increase testing period without suffering working class economy purposeless
7,0.35607557743676094,0.0803273668062569,95,one nation one voice among singers uniting anthem dedicated frontline warriors fighting pandemic aid
1,0.3927545776277345,8.447261215405177e-06,96,india got extended pls us favour n post vids home baking netflix suggestions live stay sane hope u ur family r well n keep smiling
8,0.6999882724515962,0.6666455990331457,97,bcoz trending thought give try first cake baked noida
0,0.619984774971896,0.39998572934989696,98,bhai sir would please intervene ensure animal welfare laws followed district ji
5,0.6049635604669676,0.36993468701238474,99,alcohol dependency would got cured want addictive phase back anticipated result domestic violence malnutrition children street fights increased risk chronic illnesses govt revenue
0,0.5499952459039457,0.4999904919472256,100,esteemed training partner g k foundation empanelled skill development mission upsdm
8,0.47648362857444126,0.03299014402222428,101,india copying us good usa flyover tribute healthcare first responders essential personnel battling spread thank support together
6,0.7381247406213175,0.5905612514329966,102,symbolism done keep people country good humor extension breaks spirit people
5,0.61999204461691,0.3999879342868511,103,lockdown extend till th may
1,0.39239795211608813,0.05146754119058089,104,please stay alive profit
1,0.5499928848028667,0.4999857698454132,105,morning headlines
4,0.447222811370082,0.027805620739269454,106,us help usher green revolution importantly following guidelines thanks laying road map
0,0.27518706497863454,0.0001867891292280377,107,people used busy given much needed break
8,0.3467938864990529,0.007574877954968029,108,people stop things might extended beyond th may infection continue spread sir take stronge action
5,0.54999247469014,0.49998494959342166,109,payers started feeling indians
0,0.5245807672644254,0.2491808251670211,110,guide lines especially yog guru please look touch speaking something channels
1,0.6999646591897558,0.6666122472736036,111,morning feels b ful chirping birds pure euphonious music already day
1,0.5933983383415474,0.34682147331028035,112,best part work home starts early spends morning hours songs birds squirrel favorite kind programming music discovered
8,0.6225625176048423,0.44514623832008204,113,way thinking issue ppl hv difficulty perceiving things differently training perpetual process somethings create excitement depressive environment due welcome diverse
6,0.5637486347945654,0.2417943577245068,114,bureaucrats turned mess fear indian bureaucrat best friend fear covid grips people opportunity arisen regulatory inspectors make country dance tunes thoughts
8,0.2924087755879515,0.0514854581567698,115,started developing new habit quarantine period e waking need know people similar interest
0,0.6999958324683085,0.6666605186941965,116,full post fb
9,0.3666669306608226,2.674500253430079e-06,117,say social stigma faced survivors
4,0.3165128100893104,0.01134012460644157,118,guidelines movement stranded people lockdowndown pointing backhand index via
6,0.6999906550799272,0.6666507382269771,119,skies clear think able see ships mumbai lit tomorrow gurgaon
0,0.38511171668083233,0.004663969215311925,120,please take care everyone read thread thanks sharing wishing father speedy recovery strength family difficult time
0,0.6999414148671578,0.6665766182397438,121,great memorable day tomorrow waiting tomorrow
1,0.5643564047656894,0.2287323672481567,122,please look complaint young lad regarding powercut place since morning staying without nothing short particularly one live
7,0.5241716634982462,0.24834605964298523,123,doctors god lives earth save us
5,0.49035359908639725,0.09500838629762814,124,unlike home vehicle aircon jet c hv aircon vent system using hepa filters cabin air also used pressurisation metered fresh air mixed q begs answering everyone using masks risk mitigated checked infection pre boarding
5,0.3979961993079154,0.15599620385351742,125,message hon ble cm sh manohar lal broadcast today state hookup pm tune khz newsonair app listen programme
1,0.6999999998065005,0.6666666663725177,126,cooking diaries quarantine mom made amazing gulab jamun hapur
1,0.6999999998065005,0.6666666663725177,127,cooking diaries quarantine mom made amazing gulab jamun hapur
1,0.6999999998065005,0.6666666663725177,128,cooking diaries quarantine mom made amazing gulab jamun hapur
5,0.3537282030726406,0.13791652878679259,129,wonder states eager get rid migrant labours look lockdown wd relaxed sooner later economic activities resume real estate factories agriculture wd start without
8,0.7749978603184782,0.7499968592746065,130,always smoking doobie thinking life missing tabhi ek dost ne beedi pakda di mi life seams komplete
1,0.35754483774938395,0.019774254738887553,131,generating awareness disease one crucial part controlling certain level stigma regarding covid still persist aming people health education promotion minimum
6,0.5011255468279304,0.20227301790232233,132,sirs aragyu setu app phone showing one patient within vicinity metered residence kindly take appropriate action
8,0.45006415030572816,0.06013350398381262,133,many neighbours whatsapp group asking go visiting people since relaxations announced response anyone told relax
4,0.5570267362296836,0.24738694409355244,134,lockdown allowed prohibited red orange green zones simple ready reckoner
8,0.7749704510222631,0.7499627220483405,135,let virus waste anymore time cause really prices batch starting week
6,0.5249740906125725,0.24997612054117258,136,dramatic effect never active memory l ever gone bald okay happened mistake regretting one bit nice ya think
5,0.36666646381064494,6.038938563046603e-06,137,another one bites dust
1,0.4189860000329705,0.0869459535818155,138,migrant workers returning home threats help ensure integration back community together fight
2,0.420978254429085,0.0019855497822802715,139,built finest minds india leading way towards healthier tomorrow download app today
9,0.5499999999007039,0.4999999998856399,140,going badly
0,0.3666606758046047,1.1711454901586205e-05,141,different types push ups must try fun
1,0.49575064918349554,0.20744688825910146,142,guys please download arogya setu app made government india recomend friends family inform infected person near alert
5,0.4730294633000816,0.10605892667941486,143,allowed containment red orange green zones chart tells
6,0.5499944883858394,0.4999892792103419,144,saved us mess
5,0.8499963735064846,0.833326876601576,145,sale liquor allowed zones certain riders thread activities allowed
0,0.46068885119650144,0.054729305228450376,146,look wrong look wrong country instead looked seek basis response unprecedented one cannot blame one consider
8,0.47737121229639073,0.0880852496666929,147,earthquake haryana really felt tremors intensity first time life god bless stay safe
8,0.8199896162384348,0.7999839782119001,148,want know think want believe
8,0.8499876546387327,0.8333162577576277,149,think understand teach someone best way live life experience coach
5,0.5499935117270052,0.49998702358736136,150,waiting waiting waiting back action
3,0.6999711546067916,0.6666090206605765,151,important message ips r p meena dcp south east delhi
3,0.6999711546067916,0.6666090206605765,152,important message ips r p meena dcp south east delhi
8,0.5249758786680931,0.24998661604354105,153,important guidelines staff visitors banks atms prevent spread
7,0.5365884676255476,0.27318023805612895,154,samba knows aarogya setu app coronavirus download app amp encourage others around
0,0.6999979862203362,0.6666626726298016,155,advisory homemade protective face mask
1,0.4866058633795667,0.10655308883088843,156,good morning everyone love habit waking daily whats habit
3,0.36666680490327136,2.2870773333683037e-05,157,story rwa delhi colony becomes stick support lonely senior citizens
0,0.43548461540908895,0.03097711359370381,158,post hope see cleaner free
7,0.6999999496391548,0.6666665660040166,159,single pint save three lives single gesture create million smiles
5,0.5499489099765359,0.4999319678478096,160,believe hard work luck
4,0.36666557336860867,5.46389857575269e-06,161,sadness realise one waiting meet lockdown
3,0.774964101073079,0.7499499798427377,162,guidelines brief delhi india
3,0.774964101073079,0.7499499798427377,163,guidelines brief delhi india
1,0.44285576521418063,0.28389599305360924,164,training mind muscle days done quality reading quarantine stay home read books
3,0.774964101073079,0.7499499798427377,165,guidelines brief delhi india
9,0.6999905589877635,0.6666534415121961,166,know trust anyone else using plz share km snap shots url
1,0.5499936839146218,0.4999873680819178,167,stop consulting lawyer economic problem amd others legal issue lawyer cannot economist
8,0.4353034985220633,0.04890744718302653,168,following back p family appreciate work want give back therefore follow back everyone pyar se jaan bhi le lo saab
2,0.3791251280792445,0.024933193850073254,169,parenting covid day choose words wisely reacting spending cause often comes onto
9,0.3666668192286143,3.0528993466560905e-07,170,going gets tough stand together says narrates touching story someone helped pregnant lady reach hospital
8,0.5857132128575266,0.2857247992189293,171,live life king size papa enjoying quiet evening ancestral home always miss carefree life lived sweet childhood memories playing roof top enjoying greenary well lots learn
1,0.3982686565643984,0.15653996053530875,172,death toll rises cases climb union health ministry ohh allah safe us
0,0.5249800447562815,0.24998814132713876,173,happy working home
3,0.7749734084164538,0.7499578736305035,174,extension new guidelines relaxations delhi
3,0.5252738073657551,0.3090175431039393,175,delhi cm asks city citizens accept coronavirus learn live statement city riddled fresh spurt cases unending spiral daily epitome failed governance complete surrender government
1,0.5323672970807406,0.28974242277530593,176,delhi government gameplan tackle problem pollution odd even opening mandis odd even relaxing lockdown odd even sprinkle free electricity water sordid horrid inept someone governance
7,0.7749897747070716,0.749985397828904,177,basically country realises prolonged futile destroyed lives uprooted communities less ruined economy
1,0.5499832196946848,0.499973838112573,178,ministry home affairs named ministry clarification affairs period
1,0.48317055218470517,0.16636520916199077,179,delhi records highest one day spike reports
6,0.6999618414622476,0.6666055983279333,180,followers still donating blood dangerous situation
8,0.6999660229134534,0.6666216782988347,181,best time year
6,0.549992966990324,0.49998593426141946,182,webinar assessment current situation planning persons south asian region light organised south asian group
1,0.36666626328272944,4.033406609260659e-07,183,quarantine dairies lockdown extended
3,0.5820285894100489,0.3240653714410508,184,coming new delhi india
2,0.7749794952582351,0.7499652897523209,185,addressed webinar today discuss strategies revival jewellery industry aftermath covid discussed ways means tide economic crisis jewellery industry export processed jewellery plight goldsmiths
7,0.5207256509957617,0.24145157204260836,186,corona updates case wearing homemade mask
1,0.5499903332072934,0.4999847919767519,187,happiness quality soul function one material circumstances
3,0.5499998346668713,0.49999966937101864,188,delhi airport resume flights terminal allot entry gates check bays airlines
8,0.5499999998260837,0.49999999975929893,189,waiting world press restart button
1,0.5152371116674829,0.11938635949672421,190,really salute prime minister government doctors polish media delivery boy really eveyday step house please support government thank modi sir
9,0.6999719620593303,0.66661999388344,191,infected persons like around moment increasing geometrical progression requires medical attention
6,0.699971253666606,0.6666246557314361,192,indian farmer devises motorcycle take daughter school
7,0.624293798832321,0.38193121925512263,193,indian navy fires flares air mark gratitude appreciation frontline workers including healthcare workers sanitation staff police personnel fighting
1,0.5499999998414379,0.49999999981770094,194,weather made parvati poo loving cloudy weather wearing limeroad
3,0.9307670495524668,0.9230739712515149,195,mark words cm delhi open approach delhi next new york terms mortality number cases last week may rate new york since last weeks
8,0.683322732330041,0.49999954179691397,196,vaibhavshukla government least show transparency amount come c g know much amount generated much amount spends tackle
3,0.3822251883275604,0.03112199787582981,197,new normal corona age
6,0.6999710358420909,0.6666169598416033,198,basically tomorrow monday people sunday others saturday know sure tuesday
0,0.5499662738461698,0.499950232514668,199,honoured encouraged support initiative
7,0.5499417294646801,0.4999166085636743,200,artisan putul midya sabang paschim medinipur west bengal beautiful textile making guess putul
4,0.6999443440780043,0.6665786363888441,201,sathi india organization ngo day date
5,0.5217518304267638,0.203512203224678,202,reposted touch infra red thermometer back stock could order inclusive price inr delivering across india
3,0.5354115212839465,0.1851174544737892,203,time come open delhi ready live coronavirus kejriwal
3,0.5249999416379433,0.2500008572034764,204,necessary contain delhi fully ready relax lockdown restrictions delhi cm
4,0.27500023656371125,4.045829700705106e-07,205,something better nothing learning everyday solutions institute forensic science
0,0.4826891574201776,0.1654091664550547,206,bot misinformed development india biocon md already announced end year vaccine would ready correct wrong
