Topic,Topic prob,diff,Document,Tweet
1,0.9181721215286139,0.9090783162051602,1196,modi government spurred indigenous production n masks production per day leaped times end april per day production march
0,0.871401558045257,0.8571041088751147,1197,jan aushadhi kendras setting new record working war footing lakh persons availed quality medicines per day visiting jan aushadhi kendras far
5,0.8999894317080177,0.8888717796060959,1198,modi govt facilitate return indians stranded abroad compelling grounds phased manner begin may th asymptomatic passengers allowed travel medical screening
5,0.7849982128701476,0.6589061645198778,1199,indians stranded abroad due covid return home vande bharat mission may th onwards people stranded countries brought special flights phased manner
9,0.4072578878361998,0.0027688277543577167,1200,social distancing key tackle covid even districts green zones completely corona free orange zone districts significantly lower risk infection time lower guard maintain social distancing via n
3,0.6050108232476706,0.2989177731052233,1201,fight covid indian railways rolling train hospitals tier ii tier iii cities well villages far indian railways already converted train coaches isolation centres
2,0.8499885975862669,0.8333168726144142,1202,meet increasing demands ppes modi govt giving major thrust indigenous production ppes march india producing lakh ppe may
2,0.8199999911716944,0.7999999870664622,1203,smart cities harnessing technology tackle covid nashik smart city taken initiatives mobile applications body sanitization machines strengthen city fight covid
2,0.6715312409285372,0.47639742216357117,1204,modi govt launched ayush sanjivani mobile app useful generate data usage ayush advocacies measures among population impact prevention covid
2,0.8874969545564765,0.8749958301153709,1205,india history pioneer field ayurveda modi govt working address covid crisis country clinical studies ayush systems
2,0.6005494254253602,0.43539105511752657,1206,india post offices geared performing strong covid warriors delivered testing kits regional depots designated labs covid testing across length breadth country
1,0.4920722994883196,0.05082228659734278,1207,strengthening public health preparedness govt asian infrastructure investment bank signed us million covid emergency response health systems preparedness project first ever health sector support bank india
2,0.8499919925987773,0.8333194436773221,1208,india working diligently towards finding covid cure covid vaccines different stages development
9,0.349998688396498,0.014741636256886681,1209,urge post rescue appeal videos social media details description location situation media houses help voice
4,0.4199999149137661,1.7582604064370067e-06,1210,folks right ease lockdown dowe need lockdown arvindkejriwal
5,0.2844144661568732,0.005667410680803231,1211,going barbershops st day reopen
3,0.8199898953109314,0.7999836886378626,1212,mortality update top states uts lowest mortality rate india tamil nadu kerala bihar odisha delhi
7,0.5499998126078586,0.4999996253312957,1213,chirag sandhu class xii student modren school vasant vihar writes lives livelihoods brace impact
9,0.5249846302004211,0.24998441572423424,1214,rain thunderstorm morning earthquake afternoon delhi going absolute crazy
8,0.5499999999080522,0.49999999989425176,1215,need find adventures anymore adventures find
0,0.6999757982886599,0.6666204110038838,1216,vile hashtag ever result pitching middle class migrants lapdog media wagging tail corporate political masters look audaciously calling migrants reason crisis
0,0.5499953076193017,0.49999061542070616,1217,restoration end near
0,0.60960368051816,0.37924022611100994,1218,meri pyaari momi happy mother day love u mom lyf
8,0.43157799386012224,0.24318422535216214,1219,kaafila live fundraiser series initiative raise funds relief artists performing days instagram live sessions let come together make change
1,0.5499999994382199,0.4999999990788372,1220,itttt isss myyy birthday shit quarantine
4,0.6999376165368087,0.6665854945630019,1221,took leaf making exquisite lunch item leaves popular vegetable creeper guess day
6,0.4984882612131938,0.27745192264711116,1222,mother day corona times every mother precious let get together help every mother new born
8,0.6999615156356929,0.6666038561092881,1223,opens filthy rich must behave avoid conspicuous consumption especially need undo opulent marriage ceremonies vulgar display wealth
3,0.6199906934163194,0.3999911937338397,1224,pic new picks community park made pickle using vinegar delhi india
7,0.6999994827484352,0.6666658863343432,1225,corona updates
8,0.5499991408550239,0.4999982818660885,1226,motherhood love begins ends
3,0.422044493873357,0.00411796504862133,1227,happy mother day delhi india
0,0.5761970417510379,0.3124252307095902,1228,domestic violence women increased due india please violence home
2,0.6152392962646347,0.39048221771187086,1229,govt leadership pm disburses rs cr cr farmers pm kisan scheme lockdown
5,0.5627056572591407,0.2854189261683438,1230,question imposed first place changed th march till today changed stance created fear
4,0.5499751979733873,0.499967754566145,1231,day storm hold gulmohar
6,0.6565202924916298,0.4463868400772831,1232,let appreciate courage bravery mothers working us pandemic situation
9,0.3697782339082874,0.006230309265772616,1233,link video via
5,0.45445449027641993,0.04225410026014409,1234,post factories may deal extra cost sourcing issues govt asks erect barriers work floor provide face shields ppes short supply suggests sharing tools report
6,0.5499944883858394,0.4999892792103419,1235,stock available market contact us houseofattuendo com requirement
8,0.6861517729675464,0.5056501636256657,1236,thanks opportunity making life first video short psa alcohol drug withdrawal
8,0.320832453291521,0.02585875647950009,1237,words describe mother word enough define unconditional love sacrifice duty giving happiness happy mother day mom
6,0.46654824870840655,0.06647854551818527,1238,even period working hrs tirelessly genuine fair infinite mother loves heart today every day
2,0.5499934279670329,0.4999893854774393,1239,congratulation pm mother
6,0.3800661933141845,0.026799053530854655,1240,maa word infinite patience love care
4,0.8714219539096485,0.8571334288477369,1241,exit policy elusive minister spoke resuming flights green zone industry shot proposal saying flying green unviable india top airports red zone case rises
4,0.549957222432171,0.4999394953554833,1242,europe deploys space technology prevent chaos help firms outbreak
8,0.7749914621683485,0.7499836649880455,1243,easier go hill view much better top
3,0.7005272674913705,0.5510634793344242,1244,worldwide corona cases crossed lakhs deaths crossed lakhs deaths rate slightly came india closed k cases deaths financial markets may open higher take beating coming days carefu
0,0.6999372859430127,0.6665695634891227,1245,happy mother day pawla begmabad baghpat
3,0.8714146895524042,0.8571251623189184,1246,salute first time n every body days closely gift
3,0.8714146895524042,0.8571251623189184,1247,salute first time n every body days closely gift
3,0.8714146895524042,0.8571251623189184,1248,salute first time n every body days closely gift
3,0.8714146895524042,0.8571251623189184,1249,salute first time n every body days closely gift
3,0.8714146895524042,0.8571251623189184,1250,salute first time n every body days closely gift
8,0.6999958661488307,0.6666603816836476,1251,life success always construction
2,0.35006011902979234,0.00012846196998728132,1252,hope state governments undertaking quarantine testing measures aggressively prevent spread returning evacuees
9,0.549984747811454,0.49997666084743597,1253,please retweet
8,0.7749744716317318,0.7499668452175463,1254,give iftar kits gives happiness kit family also become part campaign
8,0.3084087403065794,0.044792406055515654,1255,want first thing heart comment one line read thoughts
8,0.6192908334550168,0.3985959280708873,1256,hardly rwas hv allowed maids inspite advisory need strong msg line ppl get deployment financials improve rwas must prioritize ppl
5,0.5499489099765359,0.4999319678478096,1257,work identity moto
3,0.275000097508187,9.621810684867782e-07,1258,make life healthy stuck delhi
1,0.6999643820440397,0.6666146452125394,1259,bilkul sahi baat government work
8,0.5798364995372485,0.27396659122649586,1260,things normal better think economy system shud depend liquor shops risky
5,0.6999926679678312,0.6666540774340226,1261,confirmed th may albeit relaxation easing restrictions
6,0.5144133803782517,0.16218667393263408,1262,giving us much needed break people work life inhumanity
7,0.6999994827484352,0.6666658863343432,1263,corona updates
7,0.6999994827484352,0.6666658863343432,1264,corona updates
7,0.6999994827484352,0.6666658863343432,1265,corona updates
7,0.6999994827484352,0.6666658863343432,1266,corona updates
7,0.2974712758551739,0.06798560050683525,1267,friends new song corona warriors covid meeta pandit via
0,0.5499876304250033,0.4999828440804269,1268,five tips deal increased risk due
2,0.6999490637414609,0.6665752354651697,1269,may sound elitist harm opening malls hotels cinema halls easy maintain sense used authority commonsense risk lifting taken
8,0.6425074476934218,0.3650252767982145,1270,dealing pandemic personal bumps road times tough yes good time spread positivity love much want talk anything feel free reach goodnight
2,0.6999792231255052,0.6666312628290717,1271,covid pandemic
5,0.549983494003753,0.4999771826659347,1272,continues today
5,0.549983494003753,0.4999771826659347,1273,continues today
5,0.549983494003753,0.4999771826659347,1274,continues today
5,0.549983494003753,0.4999771826659347,1275,continues today
5,0.549983494003753,0.4999771826659347,1276,continues today
5,0.5249931725656057,0.2500007962471513,1277,please retweet timings special trains run effect may
1,0.7057000989630923,0.5825501515115418,1278,accept truth coronavirus anyone virus carrier nobody knows stop going houses without emergency stay home stay safe
6,0.8040507431910503,0.6881156041591296,1279,easy visualise remember good done us rather bad avoided us let underestimate power know would staring practiced last two months gn folks
9,0.44631011393613135,0.1774110714821303,1280,focus secure video calling app airtel jio dont offer cross platform voip volte video call foreign compny like zoom taking advantage us
3,0.871415547378169,0.8571255421704566,1281,first time since coronavirus struck india cms seem upper hand deciding implemented states
1,0.5499999994382199,0.4999999990788372,1282,quarantine birthday
6,0.8714219000223948,0.8571327380067102,1283,every curve flattening wow moment disturbing let one us show care empathy society trying times
5,0.5249962823757142,0.24999730890701394,1284,passengers travelling special adhere health protocols prescribed destination state ut advised check protocols regarding departing
2,0.41999765767679603,0.19999792528398103,1285,firm view measures needed first phase lockdown needed nd phase similarly measures needed rd phase needed fourth says
4,0.38691180003003395,0.1369785118607486,1286,seems continue place india form another cms agreed lockdown required keep spike check
4,0.699991587964384,0.6666559668233033,1287,month old baby beats coronavirus news makes day
3,0.8199808012846382,0.7999718828389337,1288,india cases near k reach china figures likely cross china may
6,0.5499940168719502,0.49999017913669636,1289,harvard nahi hardwork hi kaam ayega waiting hardwork take action
7,0.29999972222775684,0.03392834969219821,1290,big salute scientists researchers engineers whose innovations made lives better easier happy national technology day
7,0.4661294034906411,0.22602898220203657,1291,leading way disclosing usage cm relief fund modi come clean much fund received utilized
1,0.5660383509528134,0.2463700674620124,1292,want sit cafe enjoy reading experience right even dhaba work even chai ki tapri mummmmmyy yes im whining like classist bitch sister disappointed wid
6,0.5499897177454753,0.49998366772600916,1293,site opened make mockery ppl shame
7,0.524980109898666,0.24997968506932272,1294,need hour boy proud maate efforts taking initiative ahead
8,0.44285164269742755,1.0304700587937532e-05,1295,fearsome times go outside home let go virtually share pictures goa trip relive memories
0,0.5499953076193017,0.49999061542070616,1296,timed end avoid unwanted questions
8,0.4007179168063601,0.13821780578493947,1297,nothing important empathy another human suffering feel one another going live dignity thank
6,0.4199975947296397,8.035866501110434e-07,1298,arvind kejriwal wants open delhi see current situation
4,0.7749563009603109,0.7499299082180307,1299,testing gb nagar reduced dramatically last days tests positives given formality
1,0.549976155943585,0.49996223267692697,1300,beautiful comes visiting wish amazing side effects could somehow good
8,0.5407733522041192,0.2148957500908324,1301,still pending please initiate approval procedure go road vehicle please help
5,0.5499489099765359,0.4999319678478096,1302,greatest project ever work
4,0.36666617403185575,1.0972662453423432e-05,1303,lockdown progresses hunger ration distribution dehradun
2,0.6833160815095305,0.49998762337984204,1304,railway helpline number covid helpline number working please check
5,0.3810493846045038,0.16536640674013275,1305,say state surely something people full trust sir come plan stricter rules th may please
5,0.48555772925193297,0.2711263379120772,1306,freebie area continued well delhi across non containment zone exclude noida others stay economically stand
6,0.6999551403270042,0.6665981482982726,1307,day main business see lies dimly distance lies clearly hand thomas carlyle
6,0.4318204096894612,0.05557129537837502,1308,one dare think vote bank people soul without nothing backbone nation huge risk us everyone end numbers cases increasing rapidly
9,0.366657008145533,2.9822615710273226e-07,1309,telephonic survey undertaken shall receive calls mobile number please participate survey information
0,0.36666661469853173,6.340667076276674e-06,1310,facts personal information used communication encrypted signature user never sent server one turns positive
9,0.4003747818293331,0.16704885840170436,1311,delhi police best social distancing along social work great job
4,0.6999927944762012,0.6666522557315047,1312,red blue green
3,0.3426526663897732,0.09497464589571006,1313,know demanding immediate package centre govt nagging like kid open cases increasing rapidly sir let remind cases playing lives
1,0.6999916865719596,0.6666545876212195,1314,good morning
5,0.28286173247170243,0.07408244030064728,1315,obtain covid travel day pass way back decide stop admire outlet sadly closed due open soon
4,0.6999907662091442,0.6666541170273678,1316,technically writing two days week three chapters waiting written legit worried pattern
9,0.7749833375063997,0.7499722115361522,1317,bhai please check original message ensuring safe passage apprx trucks carrying essential supplies zoji la kargil temperatures minus degree celsius
8,0.5835302717867021,0.3951054591716349,1318,make strict protocols stricter punishment please lift vaccines take time created go need learn live till invented else things would surely go hand
6,0.21999868125823577,9.475134204184332e-07,1319,today important news stay updated us
6,0.5499999996890951,0.49999999957896274,1320,young man something incredible common man
0,0.5499999998559222,0.49999999983586096,1321,read thoughts
6,0.40847160671474453,0.07181746439755515,1322,mumbai financial capital mumbai dream city patients corona virus increasing day day mumbai let us together pray mumbai save city save country please
6,0.49767831637026644,0.09536499174857982,1323,worry shall pass deprived even basic necessities people living smile hope every opd service area like caring hand always concerned health
3,0.819990380992967,0.7999825817372771,1324,complete list details run th may new delhi railway station
2,0.6411228549625602,0.41558741394269016,1325,government taking poor step solve public issue irctc mobile app working properly pls solve priority basis
0,0.5268556887494171,0.21372710539518214,1326,world looks long idyay creations feel perfect time post opening communication ready view portfolio work
8,0.42612080796626,0.17764699947346071,1327,kaha toh going win called war againsit n live wt preparstion govt pushed poor middle class daily wager poverty devasted economy smb left option workers mat help
3,0.3666384543974261,4.733409904811303e-06,1328,grapes sour remember story mark words labour shortage labour twitter indian capitalists work hard earn stand team includes labour
2,0.5499934279670329,0.4999893854774393,1329,calorie intake pm calories calorie intake calories
2,0.2755308656802459,0.0005308418731173048,1330,cm pitched continued vc pm demanded well crafted exit strategy lives livelihoods
7,0.9249885765745148,0.9166475534812725,1331,bimt salutes nation corona warriors working selflessly save lives appeal meerutians cooperate police follow guidelines lockdown
7,0.9249885765745148,0.9166475534812725,1332,bimt salutes nation corona warriors working selflessly save lives appeal meerutians cooperate police follow guidelines lockdown
7,0.9249885765745148,0.9166475534812725,1333,bimt salutes nation corona warriors working selflessly save lives appeal meerutians cooperate police follow guidelines lockdown
9,0.4200007456572932,0.20000211413556493,1334,huge crowd coming trains everywhere without following social distancing
4,0.366665629625094,7.381915420878737e-06,1335,due respect following norms lockdown staying house decisions respected
1,0.7285586050376662,0.571425195949028,1336,society working good effort kids guys please take hygiene seriously stay safe
5,0.2768356541666527,0.0018386270307436114,1337,list containment zones updated delhi available anywhere internet stay informed
9,0.5499628605018597,0.49994912474110065,1338,also shares views bridging listen
1,0.5646211426191933,0.3418670124779916,1339,expected among worst hit sectors due designers tailors fabric suppliers handicraft workers retail shops one escape contraction like tipplers fashion addicts r needed mitigate pain times
5,0.6999973252737617,0.6666617977345849,1340,another air clear series guess location
7,0.4199999109188062,3.685187867030759e-06,1341,stay home save lives tattooo model tattoo artist
2,0.5894947335576609,0.33899432544965363,1342,india infamous gender based violence ranked fourth worst country gender equality according public perception showing similar trends read article
7,0.9249885765745148,0.9166475534812725,1343,bimt salutes nation corona warriors working selflessly save lives appeal meerutians cooperate police follow guidelines lockdown
2,0.8199778619444089,0.7999573936130565,1344,india fight covid following platforms team instagram id facebook id join
4,0.7749515846913595,0.7499251028514224,1345,sector india growing many crypto reporting increase trading volumes despite
1,0.5499883100177371,0.4999804834862853,1346,voice migrant labourer
3,0.7749857398759235,0.7499764283858443,1347,goes train list bookings started yet says data pertaining special trains fed website train ticket bookings available short
1,0.4156690703135086,0.1042611160299915,1348,pls look sir priority life mess everyone work payments vultures started blood hunt troubled times happening even borrowers opted loan moratorium end march
7,0.6999723386858332,0.6666250003899337,1349,hacking police working despite happening shocked
8,0.524984721212999,0.24998477814922399,1350,alarming situation need actions taken swiftly
7,0.6833328485423689,0.5000081603290143,1351,india fights corona salute corona warriors
0,0.619999236985966,0.4000061456923246,1352,really amazing vedio coming mayur vihar phase east end apartment nephew friend pari turned year today wish happy birthday proper rules regulations
7,0.9249885765745148,0.9166475534812725,1353,bimt salutes nation corona warriors working selflessly save lives appeal meerutians cooperate police follow guidelines lockdown
7,0.5499417294646801,0.4999166085636743,1354,power women innovative yet simple making difference response
6,0.5717244647883885,0.27679323576908377,1355,depending number persons families survey done ration distributed families indirapuram need us
8,0.49245677963655404,0.342961617021319,1356,administration need take responsibilities things getting worst ground level still time put health emergency around india else thousands die solution
5,0.6199974829329639,0.3999982945507363,1357,biggest problem biggest failure govment state central managing biggest sufferer may kill management may kill jee plz something resolve
7,0.9249885765745148,0.9166475534812725,1358,bimt salutes nation corona warriors working selflessly save lives appeal meerutians cooperate police follow guidelines lockdown
6,0.3363981817489199,0.12856308022655144,1359,thank finding joy worth pursuits belief bond keeps us going evolving looking forward accomplish many milestones together abb bolna banta hai shaandar zabardast zindabaad
1,0.5499999998414379,0.49999999981770094,1360,cookie made sister request sweets aficionado sugar filled cookies baked shimary hand simply delicious
2,0.6181044791462825,0.4695426654571479,1361,bridge prevent spread india help us stay informed latest updates enable govt plan initiatives install play store
8,0.549998233779401,0.49999646764475447,1362,tips increase life vehicles tyres diring
5,0.524984787129705,0.24998534300576736,1363,ministry home affairs issues standard operating procedures movement persons train confirmed e tickets shall allowed enter station
1,0.6999668213480005,0.6666132687002959,1364,staff government medical college protests sub standard kits
7,0.4923868694618359,0.24337871613868117,1365,response uber making difficult decide spoke ola said cabs enter delhi also called haryana covid helpline info govt efficiency govts much
0,0.43274414030447117,0.13921205246889135,1366,india fighting battle corona full power support crore indians districts country completely corona free new cases corona reported districts last days
1,0.7749627159614869,0.7499418494730886,1367,please take note improve quarantine facilities uttarakhand
9,0.8199808930390968,0.7999678800954654,1368,new vid update share like pls watch
0,0.49844802118590903,0.19690919456443573,1369,sir hiding deaths due corona deal china
2,0.3229638364220559,0.11259384138973286,1370,rd countries provided students however children without internet access measures taken prevent education hampered read social impacts
2,0.2754493239401766,0.01539477610915485,1371,prevention measures new normal image passengers wearing face shields coming back india one evacuation flights via
8,0.34336284113666976,0.15340698678065345,1372,stay positive better days way
1,0.5499771866495943,0.49996628201687643,1373,future weddings like
7,0.6999706218773544,0.6666122015740703,1374,finally learnt save mangoes monkeys hang old cd tree wait make chutney
6,0.3328904637662527,0.012284309770913493,1375,trains starting tomorrow bihar brace spike corona cases usual one care deaths states especially bihar
3,0.5249843587467807,0.24999193856509433,1376,please extend last date may courses bcz
8,0.311067485840971,0.029088047319003385,1377,one things kid lockdown
3,0.45203217838534016,0.10408746392177687,1378,may possible time crisis
3,0.5249843587467807,0.24999193856509433,1379,please extend last date upto may courses bcz
3,0.3666607852488279,3.987574126451676e-06,1380,please extend last date courses bcz
0,0.5249825317119666,0.24999065576377055,1381,request allow appliances company service centers function send technicians home service refrigerator working weeks able repair due
7,0.4284951180899292,0.22831037533368506,1382,let start week deeply thank heath workers waste management personnel millions frontliners daily delivering services public current critical times
6,0.7757012373436649,0.6657092959179434,1383,tough times last tough people robert h schuller sending love energy power people pandemic
5,0.25995220373322636,0.0562592234015345,1384,advisable public interest extend lockdown till st week june pls open transport system collapse things still control
2,0.3693221642227277,0.0967801717020994,1385,india times poor save life rich save lifestyle middle class modi ji next task
4,0.36575896161317506,0.03153435931154258,1386,looks getting ppe kit hours toilet breaks drink breaks ventilation except breathing doctors nurses go thru everyday work covid wards pvt doctors duty govt hosp icus
3,0.9399915208736513,0.9333218600775949,1387,thread total confirmed cases still rising rate growth active cases doub days cgdr day moving average daily new cases day moving average daily deaths look
9,0.17928604943084658,0.012271921047105616,1388,wonderful video made students vellore institute technology vellore coming instagram live th pm interaction
5,0.35000152489213293,2.1587017880964066e-05,1389,think lockdown end th may
7,0.5499997003577232,0.4999994008103897,1390,expanding horizons age old traditional knowledge ayurveda download app
7,0.549958674492528,0.49993687935055564,1391,best solution
0,0.43274414030447117,0.13921205246889135,1392,india fighting battle corona full power support crore indians districts country completely corona free new cases corona reported districts last days
1,0.4920722994883196,0.05082228659734278,1393,strengthening public health preparedness govt asian infrastructure investment bank signed us million covid emergency response health systems preparedness project first ever health sector support bankto india
1,0.5249964980157872,0.2499969985502291,1394,amidst one reach railway station catch train indirectly asking everyone walk
