Topic,Topic prob,diff,Document,Tweet
8,0.4462287484930713,0.05247166106445311,603,staying home much fun sucks exactly one big difference choice get
2,0.42139025349998077,0.1232832806444828,604,crisis shown india needed bank neglected domestic manufacturers imports became unreliable international supply chains disrupted neglected public healthcare sector private sector geared even
1,0.47687595342237893,0.2559255360691036,605,least look banks like charging extra depositing cash non home branch least done middle class
1,0.5499903332072934,0.4999847919767519,606,one told mr relax anyway
1,0.5600199966107478,0.2343396905792749,607,respected sir please allow sale one bottle per person one time prevent black marketing long queues
5,0.8199944418619098,0.7999898712024681,608,feel early worked well happen travel red zone hinterland
0,0.4164526429384645,0.18507793813533513,609,one advise free quit politics save mother india
5,0.4123298926137365,0.13539069715534674,610,first time ever history feeling sleepy work rather would say stay pg
2,0.6833106633923073,0.4999696087175489,611,member family made greatest sacrifice fight covid may soul rest peace
7,0.6999994827484352,0.6666658863343432,612,corona updates
1,0.6999947446110619,0.6666599272682623,613,purchasing fun demotivated stand queue one bottle n
8,0.4986962497534739,0.09740607051441524,614,want ask pm cm states specially coming outside inspection watching issues public need come outside realize real effect
6,0.8199764818241789,0.7999689239550404,615,let remember one best soul indian
7,0.41659307932846806,0.19318952943532408,616,title corona warriors seems different sector noida
3,0.6999750736079131,0.6666256077560211,617,needed captions delhi india
8,0.5497760142718364,0.19955862013071718,618,hobby definition activity done regularly one leisure time pleasure hobby something enjoy normal life sure life normal life
8,0.3070595447602671,0.03267942973554905,619,hope follow footsteps extend lockdown till may th life imp livelihood delhi prepared lifting lockdown
5,0.6237778171633175,0.40757913724227834,620,back voicemail better say face
3,0.5521528429141069,0.18432202834243466,621,essential things open n till thought education important anymore important sharaaab h kyuki piyega india tbhi bdhega india
3,0.2769531354482909,0.039631855881770206,622,chronicles day major missing focussing going miss whole season due lockdown first thing comes mind missing season altogether signs resumed travel near future
6,0.38125182284089754,0.07728931520682031,623,video goes live tomorrow morning instagram handle youtube channel something little different time us friends tried show support love means world us
8,0.6829797180469176,0.4993063016483784,624,panic buying went toss problem government wants everything style always give hours give fair amount time
0,0.37284515814060004,0.01235698306015659,625,positive cases linked single camp cautious
5,0.6520251092380495,0.40405780291867854,626,govt allowed entry maids left decision wisdom rwa people ofcourse scared since many house keeps comes frm hotspots bt today covered maid widow runs family single tym meal gt
3,0.9249970198274516,0.9166614959533662,627,major update india crosses mark total reported cases timeline cases days cases days cases days cases days
1,0.5774819484353162,0.2692717367699758,628,without test drives w proper checking vehicles things move luk take anyhow prior dampener one expecting much car sales initiatives mind banda car chalayega kahan inside home
1,0.5774819484353162,0.2692717367699758,629,without test drives w proper checking vehicles things move luk take anyhow prior dampener one expecting much car sales initiatives mind banda car chalayega kahan inside home
1,0.4076354974599793,0.08194291412826754,630,quarantine writings post thread vaibhav jain
9,0.699964637613242,0.6665968019154331,631,keep stay strong f
8,0.36666650532824396,3.351853601563093e-06,632,want anything change us
6,0.5166575322251432,0.33332656746739936,633,govt telling everything done people emi school fee full salary job saved electricity bills food low price true
2,0.4352699489805359,0.09083150454182848,634,information want say covid death number think number important data gives formation proceed fight
4,0.5499751979733873,0.499967754566145,635,rd day spending journey
4,0.8499905992539696,0.8333198768059551,636,update india crosses recoveries days days days days
6,0.4060907214199366,0.21218913181726262,637,positive enough mom overcome difficult times corona virus soon join
8,0.47006686821320015,0.14013754100860654,638,till authentic genuine profiles world weddings simplified elite matrimony bureau trusted matrimonial agency serving clients since ages created niche market
4,0.5499751979733873,0.499967754566145,639,day blanket
5,0.2586043691566398,0.038698466138247234,640,delhi govt must provide immediate financial help tailors barbar well bcz r worst affected
8,0.22238410270000333,0.00238389384596957,641,lajpat zilla mask force important fight video
9,0.3666626025254222,2.6221279836313727e-06,642,shops except n remain shut
4,0.36666350052535424,2.821911107009356e-07,643,distribution face shield food vendors ward
6,0.5499999998235148,0.49999999979705456,644,certification done dusted
6,0.40526035564238866,0.12718171559566865,645,dear indian government please take advantage generate revenue another addiction comparatively healthy e fitness
7,0.6999994827484352,0.6666658863343432,646,corona updates
3,0.3666666037834347,6.428972243843756e-06,647,pleasure serve senior citizens door step one customer served pushpanjali branch delhi circle service beyond routine service
7,0.5712240726544519,0.2567635195869145,648,indeed good work wat abt citizens already stucked different part country much symphaty abroad ppl marginsed ppl nation
4,0.6999443440780043,0.6665786363888441,649,sathi india organisations day date
1,0.6999703507992968,0.6666238104543042,650,work efficiently home latest laptops available nearest ep store enquire
8,0.5536348351301618,0.3072996296262227,651,hope film encourages get admire around please maintain
9,0.5499753960943704,0.4999614828026594,652,fill captcha know poll name x
4,0.5499999998142441,0.4999999997854056,653,learning everyday
8,0.5499934894125097,0.4999899552973463,654,least become norm matters heard spent entire virtual courtrooms become fascinating less cumbersome better organised
0,0.30000080091571457,0.01696866898861582,655,thank ji idea inspire us make mask family members
3,0.5499998346668713,0.49999966937101864,656,dwarka delhi
6,0.4468777857196284,0.14404672355425507,657,important thing us always learning push boundaries find something new different shoot daniel lindsay stark
5,0.6960671312469343,0.5254745365476174,658,wfh discoveries people passionate work workout depend office gym really work happen well meaning joy comes ur team kind drab without colleagues thx gr rescuer
8,0.5099318055680689,0.17988295361404366,659,important guidelines followed shop owners essential commodities prevent spread
8,0.5292212682048002,0.21846052512939307,660,lost leg yrs ago accident since wife earning member family however lost income kit help us sail ashok surat nagar
8,0.6945717436442048,0.5225019164590258,661,first look video hope guys love small glimpse
0,0.45959204312331653,0.11921448171424504,662,positives watched starring feels great connect long time yes ancestry also hails fm
5,0.4284525465600982,0.016930360865495986,663,dont people report help rather sharing say govt enough
4,0.5868823054240829,0.3737668197614076,664,life green zone
2,0.4964582117020432,0.2929191094034531,665,urban indians give high ratings govt handling covid crisis survey
6,0.5030640648403241,0.2995003414098689,666,best thing wednesday pm yoga class sonia kaur join us relax muscles
7,0.699998712458439,0.6666646685726748,667,thank ruchika appreciate kind gesture thank contribution
1,0.7749624057736628,0.7499291545230292,668,seems n take n advisory seriously contain respectively
8,0.34999763636557096,0.0004875804346712864,669,love natural air always fresh new delhi
4,0.5499885720822495,0.4999774260787317,670,days handles stranded passengers mts cargo evacuation cargo flights operated period
9,0.6999981131753277,0.6666637386338019,671,summer essentials keep eating citrus fruits drink juice forget keep juice glass bottle serve
5,0.49730571722938505,0.19461329806110828,672,another symptom covid toe could cause blood clots may result swift sometimes fatal damage
2,0.6307215018927802,0.32298614576539997,673,modi govt ensuring safety health personnel fight covid lakh n masks distributed far across states
3,0.5239754359998956,0.16224383196572362,674,modi govt ensuring enough reserves ventilators emergency situations th may ventilators available active cases needing
1,0.9181721215286139,0.9090783162051602,675,modi government spurred indigenous production n masks production per day leaped times end april per day production march
0,0.871401558045257,0.8571041088751147,676,jan aushadhi kendras setting new record working war footing lakh persons availed quality medicines per day visiting jan aushadhi kendras far
5,0.8999894317080177,0.8888717796060959,677,modi govt facilitate return indians stranded abroad compelling grounds phased manner begin may th asymptomatic passengers allowed travel medical screening
9,0.516645574038358,0.3333121334266015,678,going interactive rebooting reinventing travel tourism business continuity post stay tuned latest updates
6,0.6999776988486327,0.6666274237069377,679,handle times worthy reading good news story inputs
9,0.5774071652460734,0.3148274443480913,680,obviously people issuing notices know going real world
8,0.2969924627986436,0.0220037023185935,681,small minded political losers keep raking bogus issues run prime minister continue ignore remain sharp focused sailing india biggest since yemen war
8,0.788234214499533,0.6653603273131822,682,wonderful initiative sir definitely help people want self employed right live dignified life self sustaining models need hour
0,0.5166608759020208,0.1666644909817548,683,apprehension sabir prem nagar joblessness post lock state cloth mask making option thanks crpf machine
3,0.7749947939147678,0.7499929030066913,684,highest case reported hours states maharashtra gujrat delhi tamilnadu panjab highest death case gujrat maharashtra rajasthan mp west bengal new case death hours
7,0.7749732931673606,0.7499476669077837,685,aarogya setu app punishable offence say aarogya setu police commissionerate noida
1,0.4620491904814599,0.14858267921131468,686,corona virus cases near thousand please stay home stay safe save life save nation
0,0.7223825585602331,0.5590653381155193,687,lakh meals served far migrant labours exceptional service underserved thank everyone contributed noble initiative happy small part contribute
1,0.7749948476086974,0.7499927705795371,688,good morning everyone photography hari nagar rajouri garden
9,0.8714130862138767,0.857119011902458,689,write discussing importance allowing home delivery liquor better manage social distancing measures necessitated
5,0.4225659310968785,0.11181739309428568,690,often moves without fear thru lawns day
1,0.360808903638117,0.08161998856776626,691,therefore good example communities family expresses health professionals cleaning staff delivery boys drivers auto technicians many
2,0.5424942543150784,0.21833148752564469,692,modi government saved india major coronavirus outbreak ram madhav via
7,0.6999809347570555,0.6666359288911607,693,spending easiest way revive economy says nobel laureate conversation former congress president rahul gandhi
1,0.549976155943585,0.49996223267692697,694,good news true
8,0.5407707072887364,0.2815463939709928,695,odd thinking company individuals bailout need discussion reorganisation living production systems logistical methodologies need discussion stimulus packages everyone locked stimulated company guy
8,0.7749820302808141,0.7499708018488962,696,goal get rich things must
9,0.8714130862138767,0.857119011902458,697,write discussing importance allowing home delivery liquor better manage social distancing measures necessitated
8,0.6999972382227386,0.6666619422281961,698,live love laugh
0,0.5499952459039457,0.4999904919472256,699,esteemed training partner g k foundation empanelled skill development mission upsdm
8,0.5499999998829456,0.49999999986538285,700,grow go selfie
7,0.36666668583563633,5.471948673063665e-07,701,pretty natural thick things improve partially lifted requires cooperation efforts
6,0.38433280978847645,0.08615287462330135,702,although depressing expected lines supply side logistics pose many challenges fronts travel daily requirements ppl need sensitised appreciate take supplies stabilise lifting mantra
6,0.6199891427619706,0.3999936501533267,703,global search indian effort collaborative hopefully hv mar flattening curve vigorous contact tracing testing segregation done successfully many needs follow economic hara kiri continues easy answers
1,0.5163562695971725,0.3064287830846444,704,kw group wants tell mandatory every smart phone user download arogya setu app mobile protect covid violaters may face legal action stay home stay safe
1,0.5163562695971725,0.3064287830846444,705,kw group wants tell mandatory every smart phone user download arogya setu app mobile protect covid violaters may face legal action stay home stay safe
0,0.6999981339697136,0.6666629347034946,706,everything ok end ok end
1,0.5499981661726491,0.49999633244541075,707,health wealth
6,0.5499999996890951,0.49999999957896274,708,something fishy happening
9,0.6442075067692491,0.36115617756903595,709,markets full people today dont know happen sector sector shops open social distancing
4,0.7749810478148863,0.7499703698241337,710,lockdown india eased self lockdown continues
4,0.5499872614719167,0.49997452337099446,711,zone couriers delivered area
4,0.5499999998142441,0.4999999997854056,712,looking everyday missing
5,0.3681839792614903,0.0030346253755096364,713,wow another great news
0,0.4151204638526931,0.1302274824562814,714,someone know stuck chennai last months due uae national wants go country flights going uae next week someone offer help guidance
9,0.6060863545914691,0.37218425496684593,715,watch full video youtube link bio tag harami friends
6,0.4544168323533515,0.06884467951963646,716,lots people registered themself joob seeker best platform providing platform also reducing unemployment view website start function immediately
9,0.6060863545914691,0.37218425496684593,717,watch full video youtube link bio tag harami friends
9,0.6060863545914691,0.37218425496684593,718,watch full video youtube link bio tag harami friends
2,0.52497596716362,0.24995509255362697,719,discrimination healthcare service personnel punishable law stop violence together fight
3,0.36666682668218475,1.9292765292500125e-05,720,news flash haryana government planning introduce weekly pass delhi gurugram movement officials
9,0.7624945218968182,0.6249961143752244,721,please vast food please watch full video plz follow twitter
6,0.5681663659472459,0.250623280132237,722,nowadays people also suffering humble plz take proper care always wear going
9,0.5682321763640451,0.2691439229401645,723,even districts green zones completely corona free orange zone districts significantly lower risk infection time lower guard please follow social distancing norms guidelines issued government
8,0.8714285476937763,0.857142809706788,724,want give shelter want give wages want go either dangerous humanity pls extinct
2,0.367362210248858,0.08871260327120001,725,post covid lockdown india public transport systems able maintain social distancing
8,0.4840058083862184,0.2155095476854531,726,would finished long due task would get ample time killed days still situation human nature criticize time kill
9,0.5499967400099424,0.4999949735375725,727,nov loyalty rare find keep
1,0.39987747501417353,0.06642590550423227,728,quarantine look
7,0.6999994827484352,0.6666658863343432,729,corona updates
7,0.7749990823989044,0.7499982830767195,730,salute corona warriors dedicated song maalik sambhaal lena
1,0.5499999994382199,0.4999999990788372,731,wonder long shoes clothes quarantine
7,0.6999994827484352,0.6666658863343432,732,corona updates
3,0.8874950669290659,0.8749927932951496,733,crossed mark cases cases still active patients recovered coronavirus rises total test conducted
6,0.6999962314163491,0.6666609932389796,734,every situation changed person
2,0.49838776228347276,0.19679800489623128,735,list affected states india due
0,0.6999702693234632,0.6666112047965038,736,party st dec celebrate end year instead welcoming next year
3,0.7749689025636707,0.7499555088250216,737,shine like sun delhi india
9,0.8714195745454608,0.8571299385903225,738,new video released like share video must subscribe channel
6,0.6337519869463042,0.38180247599246503,739,blade cut anything forged blast furnace always red hot yes shaped many many ways r evolved leading many fronts day proved worth
3,0.5499519161807457,0.4999298429115785,740,getting bored spending time reading spending write got story write publish blog
9,0.437480649087425,0.174986789046432,741,politician hope explain logic order one agree order till lockdown agree follow orders also follow orders remove
8,0.8713931148629911,0.8570984756803203,742,ienergizer first step career couple months working provided salary critical situation regret starting good firm thanks support
5,0.3413078705103325,0.0005333405985927242,743,sad see money send flights pick indians abroad money anything get people back hometown
9,0.5250003738488385,0.25000519845352903,744,much social distancing
6,0.46807691119181327,0.02504943236344831,745,watched sir heart warming performance always good see screen every single time brilliant sir two hours emotional ride totally loved
6,0.8499769728184722,0.8333039853037306,746,hon ble cm rightly said good environmental policies also make good politics time arrived lead change realign street retain environmental gain concept guide traffic circulation
8,0.36666543068625834,5.93273228888247e-06,747,return cubicle companies rethink life post
7,0.6428570945281168,0.34727057862017485,748,new concept u u shud start comedy chat show superstars way get also going manage must say u shud think
7,0.5499997003577232,0.4999994008103897,749,found app group
8,0.39213846688736603,0.14781162229145622,750,wonder bangladeshi infiltrators never get homesick therefore go back despite bd economic progress problem people states got homesick country may due go away
3,0.5053756668946726,0.21077034280852575,751,feeling u open years mix th water
8,0.8199696318013984,0.7999608967514422,752,always chanting name god necessary moment help someone also good devotion
9,0.7749976860473606,0.7499967007829189,753,watch hing aloo ki sabji please keep uttam nagar
5,0.5249996332119884,0.2500066479018328,754,sir allowed travel hometown almora noida self driven
3,0.4949383146397928,0.18987829433097453,755,aiims director randeep guleria says witness peak number covid cases months june july
6,0.5249943050620568,0.2499950828172231,756,painful corona pandemic situation
5,0.549976082716998,0.49995966350411253,757,picture clear true thanks sharing information ap news channels ki wajha se desh bach gya
4,0.5499751979733873,0.499967754566145,758,day le moon pic
1,0.6546201936802345,0.4235431083020654,759,peak june july surely first wave expect second wave post monsoon winters prepared delhi economical loss health fascility human lose resources adjustment villages migrant workers trying reach ram bharose
3,0.887494244150711,0.8749927237081659,760,crossed mark cases cases still active patients recovered toll rises total test far
3,0.5379102502992131,0.30859020870840537,761,cases india delhi maharashtra gujrat complete lockdown places state look economy subsidies states
4,0.36666563018969184,3.6502982833086506e-06,762,year wanted find girl get settled lekin jis tarah se lockdown badhe ja raha hai lagta hai meri dulhan aazaadi hi hogi
5,0.8199819991186561,0.799973367525654,763,home ever since symptoms kind travel jharkhand citizens middle class expect consideration government
4,0.5499751979733873,0.499967754566145,764,dream day taj mahal agra city
6,0.5499999996890951,0.49999999957896274,765,something cooking guess
8,0.5948808472037249,0.2897986214338837,766,people working quarry facing lot difficulty procuring basic food items since forced daily income distribution dry ration kit anagaputhur become support
1,0.7845286129130528,0.6579612596471105,767,please retweet healthcare workers help woman recovered delivers healthy child good health support welcome back home
5,0.44597918797320324,0.2583921509095828,768,govt need take decision opening economy particularly green orange zone malls also opened zones sort revenue flow credit govt unless lifted economic activity gets opened
9,0.8714214108447581,0.8571318441510791,769,watch new video youtube mobilities please like share subscribe channel
7,0.49491976390628006,0.14985706915110808,770,sir dance pure emotions u sir plz reply make successful
8,0.37192852918966,0.043859970450943586,771,great things bringing small steps right direction one trainee sharing experience online training learning stop
8,0.4940727869666665,0.08815572354983864,772,rajkamal aich exhibits condition country first half current week follow invincible web solutions fb instagram twitter get interesting updates daily contact know
5,0.549983494003753,0.4999771826659347,773,today anti mosquito spray c sda guidance area councillor mrs radhika abrol
7,0.5499997003577232,0.4999994008103897,774,kisan rath app farmers
7,0.38777924796225594,0.042254980557377475,775,injured cow reported near pi rescued help thank dr prem chand
3,0.36666665531702264,4.534853877524725e-06,776,change brand change shop visit website get groceries delivered straight door delhi ncr
6,0.7749796479301408,0.7499670710994305,777,winging ps one best wings ever done
8,0.4757324862031724,0.08481256493556272,778,already aware countless benefits reading little know also help easing anxiety stress pick book get going
3,0.5499698259411478,0.4999456717721522,779,mango peach custard first mango year
7,0.5499910985533704,0.4999822155041646,780,reason mum issues related much
9,0.5401122127642899,0.21357993964051414,781,expect measures stop spreading illegal use government land environment people avoiding using cars tool storage place goo loo open spit
2,0.699961917678887,0.6665971658144515,782,expect journalists across different medium condemn attacks fir journalists oldest democratic secular party
9,0.5170757159706109,0.23416706429353457,783,keep middle seat empty million dollar question facing airlines regulators need scenes witnessed pk lahore toronto passenger upset measures board
3,0.27500024029565906,9.543466705785875e-08,784,read failure stories also become successful delhi ncr
9,0.5334759654968739,0.26697270336757245,785,telling us share message warning deleted server fake wrong way information circulation
4,0.4269046406887868,0.1747885809493348,786,clothes help prevent illness free home pick care com b srs royal hills sector faridabad haryana
2,0.6307215018927802,0.32298614576539997,787,modi govt ensuring safety health personnel fight covid lakh n masks distributed far across states
3,0.5239754359998956,0.16224383196572362,788,modi govt ensuring enough reserves ventilators emergency situations th may ventilators available active cases needing
1,0.9181721215286139,0.9090783162051602,789,modi government spurred indigenous production n masks production per day leaped times end april per day production march
0,0.871401558045257,0.8571041088751147,790,jan aushadhi kendras setting new record working war footing lakh persons availed quality medicines per day visiting jan aushadhi kendras far
5,0.8999894317080177,0.8888717796060959,791,modi govt facilitate return indians stranded abroad compelling grounds phased manner begin may th asymptomatic passengers allowed travel medical screening
5,0.7849982128701476,0.6589061645198778,792,indians stranded abroad due covid return home vande bharat mission may th onwards people stranded countries brought special flights phased manner
9,0.4364826873577642,0.07503514329886984,793,social distancing key tackle covid even districts green zones completely corona free orange zone districts significantly lower risk infection time lower guard maintain social distancing via nam
3,0.6050108232476706,0.2989177731052233,794,fight covid indian railways rolling train hospitals tier ii tier iii cities well villages far indian railways already converted train coaches isolation centres
1,0.683331501028436,0.5000002804319951,795,happy buddha purnima stay home stay safe musical dreams
2,0.8499885975862669,0.8333168726144142,796,meet increasing demands ppes modi govt giving major thrust indigenous production ppes march india producing lakh ppe may
1,0.5856890469295427,0.28570498908294584,797,post real jobs like manufacturing rendering real services like restaurants malls market complexes salons places like ultimately return geographical spread may change particularly case manufacturing
5,0.549985567167306,0.4999732662809886,798,th class ch revision lecture
3,0.36151404595536674,0.02304210666510509,799,first repatriation flight air india express ix take kochi kerala abu dhabi today
1,0.5499832196946848,0.499973838112573,800,effect neighbours practicing home
6,0.5302258309091993,0.26045392390485794,801,protocols followed reopening people pay price lives whether govts take action
5,0.3666589302859181,9.172549232994154e-06,802,th class ch revision lecture hope helpful students
6,0.774971342897073,0.749959399041146,803,let us pray peace harmony mankind auspicious day buddha purnima
